{
  "$schema": "https://srs.semanticops.com/schema/2.0/field.json",
  "aiGuidance": {
    "purpose": "Sort direction for a DocumentSection's field-based ordering. Default: asc."
  },
  "createdAt": "2026-07-29T00:00:00Z",
  "description": "Sort direction for a DocumentSection's field-based ordering. Default: asc.",
  "id": "4b0000c2-0000-4000-a000-0000000000c2",
  "name": "sort_direction",
  "namespace": "com.semanticops.srs",
  "fieldType": {
    "datatype": "string",
    "valueDomain": "closed",
    "allowedValues": [
      "asc",
      "desc"
    ]
  },
  "version": 1
}
