{
  "$schema": "https://srs.semanticops.com/schema/2.0/field.json",
  "aiGuidance": {
    "purpose": "RFC-014 (ext:import-tracking) — top-level normative provenance stamp for a repository initialised from an upstream Package."
  },
  "createdAt": "2026-07-29T00:00:00Z",
  "description": "RFC-014 (ext:import-tracking) — top-level normative provenance stamp for a repository initialised from an upstream Package.",
  "id": "4b0000b2-0000-4000-a000-0000000000b2",
  "name": "upstream_package",
  "namespace": "com.semanticops.srs",
  "fieldType": {
    "datatype": "ref",
    "mode": "inline",
    "rangeType": {
      "typeId": "4c000028-0000-4000-a000-000000000028",
      "typeVersion": 1
    }
  },
  "version": 1
}
