{
  "$schema": "https://srs.semanticops.com/schema/2.0/field.json",
  "id": "a1b2c3d4-e5f6-4a7b-8c9d-0e1f2a3b4c5d",
  "namespace": "com.semanticops.srs",
  "name": "tag-key",
  "version": 1,
  "description": "The raw tag string (e.g., \"foundation\") used as the primary identifier for the tag.",
  "fieldType": {
    "datatype": "string"
  },
  "createdAt": "2026-05-28T00:00:00Z",
  "aiGuidance": {
    "purpose": "The canonical string identifier for this tag. Must exactly match the string used in Note.tags and NoteSection.tags.",
    "extraction": "Use the exact tag string as it appears in usage — typically lowercase, kebab-case."
  }
}
