{
  "$schema": "https://srs.semanticops.com/schema/2.0/field.json",
  "aiGuidance": {
    "purpose": "The Relation type name: a canonical vocabulary entry (contains, depends-on, supersedes, refines, derived-from, evidences, precedes) or a custom namespace/name form. Shared by Relation.relationType and RelationSpec.relationType (srs#526: same meaning, different Types — reuse over duplication)."
  },
  "createdAt": "2026-07-29T00:00:00Z",
  "description": "The Relation type name: a canonical vocabulary entry (contains, depends-on, supersedes, refines, derived-from, evidences, precedes) or a custom namespace/name form. Shared by Relation.relationType and RelationSpec.relationType (srs#526: same meaning, different Types — reuse over duplication).",
  "id": "4b000066-0000-4000-a000-000000000066",
  "name": "relation_type_name",
  "namespace": "com.semanticops.srs",
  "fieldType": {
    "datatype": "string"
  },
  "version": 1
}
