{
  "$schema": "https://srs.semanticops.com/schema/2.0/field.json",
  "aiGuidance": {
    "purpose": "AssetDeclaration.mode — the asset's locator mode."
  },
  "createdAt": "2026-07-29T00:00:00Z",
  "description": "AssetDeclaration.mode — the asset's locator mode.",
  "id": "4b0000f3-0000-4000-a000-0000000000f3",
  "name": "asset_mode",
  "namespace": "com.semanticops.srs",
  "fieldType": {
    "datatype": "string",
    "valueDomain": "closed",
    "allowedValues": [
      "local",
      "remote",
      "inline"
    ]
  },
  "version": 1
}
