{
  "$schema": "https://srs.semanticops.com/schema/2.0/field.json",
  "aiGuidance": {
    "purpose": "The Record type this Protocol converges on — a LINEAGE reference (bare UUID; rfc-decision-c8704763), never the canonical namespace/name@version form (DISPLAY-only, never stored). Empty string for loose, exploratory Protocols whose output is input context for a tighter Protocol."
  },
  "createdAt": "2026-07-29T00:00:00Z",
  "description": "The Record type this Protocol converges on — a LINEAGE reference (bare UUID; rfc-decision-c8704763), never the canonical namespace/name@version form (DISPLAY-only, never stored). Empty string for loose, exploratory Protocols whose output is input context for a tighter Protocol.",
  "id": "4b0000e7-0000-4000-a000-0000000000e7",
  "name": "target_type",
  "namespace": "com.semanticops.srs",
  "fieldType": {
    "datatype": "string",
    "format": "uuid"
  },
  "version": 1
}
