{
  "$schema": "https://srs.semanticops.com/schema/2.0/field.json",
  "aiGuidance": {
    "purpose": "When true, a relation from an instance to itself is invalid."
  },
  "createdAt": "2026-07-29T00:00:00Z",
  "description": "When true, a relation from an instance to itself is invalid.",
  "id": "4b00009c-0000-4000-a000-00000000009c",
  "name": "irreflexive",
  "namespace": "com.semanticops.srs",
  "fieldType": {
    "datatype": "boolean"
  },
  "version": 1
}
