{
  "$schema": "https://srs.semanticops.com/schema/2.0/field.json",
  "aiGuidance": {
    "purpose": "Relative path to a file within the artifact that holds it."
  },
  "createdAt": "2026-07-29T00:00:00Z",
  "description": "Relative path to a file within the artifact that holds it.",
  "id": "4b0000a7-0000-4000-a000-0000000000a7",
  "name": "path",
  "namespace": "com.semanticops.srs",
  "fieldType": {
    "datatype": "string"
  },
  "version": 1
}
