{
  "$schema": "https://srs.semanticops.com/schema/2.0/field.json",
  "aiGuidance": {
    "purpose": "SRS spec version this repository conforms to, e.g. '2.0' or '2.0-draft'."
  },
  "createdAt": "2026-07-29T00:00:00Z",
  "description": "SRS spec version this repository conforms to, e.g. '2.0' or '2.0-draft'.",
  "id": "4b0000a1-0000-4000-a000-0000000000a1",
  "name": "srs_version",
  "namespace": "com.semanticops.srs",
  "fieldType": {
    "datatype": "string"
  },
  "version": 1
}
